{
  "ticketRequestId": "567a5eae74d543bcadbfeb165c37a0e6",
  "responseCode": 0,
  "responseType": "Info",
  "responseMessage": "No error occured during validation",
  "ticketType": 105,
  "oekotexFlag": true,
  "nosSeasonIndicator": "SNOS",
  "orderNumber": "705/32/77580/656",
  "purchaseOrderNumber": 80792995,
  "masterCompanies": [
    {
      "companyIsoCode": "AT",
      "itemNumber": "0123.456",
      "ticketInfoText": "CB:07_THEM _PR_TA02",
      "nationalStyleIdPrefix": "S820",
      "customerSizeRange": "XS - XXL",
      "sellingPrices": [
        {
          "companyIsoCode": "AT",
          "sellingPrice": "8.00",
          "currencyCode": "EURO",
          "sellingPriceTicketPosition": 1,
          "printedCompanyIdentifier": "A",
          "licensePlateCompanyIdentifier": "AT"
        },
        {
          "companyIsoCode": "RO",
          "sellingPrice": "34.90",
          "currencyCode": "RON",
          "sellingPriceTicketPosition": 2,
          "printedCompanyIdentifier": "RO",
          "licensePlateCompanyIdentifier": "RO"
        }
      ],
      "colourSizes": [
        {
          "colourTicketPositionNumber": "1",
          "computerSizeNumber": "056",
          "quantity": 150,
          "pantoneName": "16-5803",
          "colourDescription": "Flint Gray",
          "customerSizeNumber": "M",
          "additionalSizeInformation": "0-1 MON",
          "gtin": "04 061507 789603",
          "url": "https://qr.c-a.com/?01=04061507789603",
          "barcode": {
            "lineIdentifier": "A",
            "itemNumber": "0123456",
            "colourTicketPositionNumber": "1",
            "computerSizeNumber": "056"
          },
          "barcodeSubLine": {
            "lineIdentifier": "A",
            "itemNumber": "0123.456",
            "colourTicketPositionNumber": "1",
            "computerSizeNumber": "056"
          },
          "waistbandRiderCode": 13,
          "waistbandRiderColour": "yellow",
          "waistbandRiderText": "WEITE PASSWORM"
        }
      ]
    }
  ]
}